{
  "schema_version": "v1",
  "tranche_id": "active_codebase_alignment_repair_tranche",
  "status": "closed",
  "parent_brief": {
    "path": "var/audit/briefs/2026-04-28_ACTIVE_CODEBASE_ALIGNMENT_REPAIR_TRANCHE.md",
    "sha256": "91f230addd023d3f3875911068b7c52ddf2470e35375d7551ea26ddf6a0a40ae"
  },
  "scope": {
    "purpose": "repair control truth, Tier A registry truth, and shallow-proof inventory before next Atlas tranche",
    "atlas_records_processed": 0,
    "new_atlas_tranche_opened": false,
    "src_files_changed": 0,
    "test_files_changed": 0
  },
  "leaves": [
    {
      "leaf_id": "ACR-L01",
      "title": "Open and route active-codebase alignment repair tranche",
      "status": "closed",
      "touched_files": [
        "AGENTS.md",
        "docs/06.1_PROCESS_AND_TRANCHE_LAW_WORKING.md",
        "intent_migration/active_codebase_alignment_repair/AGENTS.override.md",
        "var/audit/briefs/2026-04-28_ACTIVE_CODEBASE_ALIGNMENT_REPAIR_TRANCHE.md",
        "var/audit/ledgers/active_codebase_alignment_repair_tranche_ledger.json",
        "var/audit/ledgers/active_codebase_alignment_repair_tranche_ledger.schema.json"
      ],
      "evidence": [
        {
          "path": "AGENTS.md",
          "claim": "active route points to active-codebase alignment repair pack"
        },
        {
          "path": "docs/06.1_PROCESS_AND_TRANCHE_LAW_WORKING.md",
          "claim": "working route supplement admits repair pack and retains downstream pilot as closed evidence"
        },
        {
          "path": "intent_migration/active_codebase_alignment_repair/AGENTS.override.md",
          "claim": "repair pack scope, leaf order, and prohibitions declared"
        }
      ]
    },
    {
      "leaf_id": "ACR-L02",
      "title": "Reconcile Tier A registry inventory truth",
      "status": "closed",
      "touched_files": [
        "config/retained_test_registry.yaml"
      ],
      "evidence": [
        {
          "path": "config/retained_test_registry.yaml",
          "claim": "tier_a_registry_reconciliation_inventory records all 67 Tier A pytest files with explicit registry status"
        }
      ],
      "counts": {
        "registered_retained_seed_tier_a": 54,
        "tier_a_file_registered_outside_retained_seed_tier_a": 5,
        "pending_explicit_registry_record": 8
      }
    },
    {
      "leaf_id": "ACR-L03",
      "title": "Inventory shallow and presence-only Tier A proof surfaces",
      "status": "closed",
      "touched_files": [
        "var/audit/ledgers/active_codebase_alignment_repair_presence_inventory.json"
      ],
      "evidence": [
        {
          "path": "var/audit/ledgers/active_codebase_alignment_repair_presence_inventory.json",
          "claim": "static AST proof-shape inventory records all 67 Tier A pytest files"
        }
      ],
      "counts": {
        "zero_assert_files": 26,
        "presence_or_structure_probe_files": 48,
        "files_with_assertions_or_assert_like_calls": 14
      }
    },
    {
      "leaf_id": "ACR-L04",
      "title": "Mandatory closeout",
      "status": "closed",
      "touched_files": [
        "var/audit/briefs/2026-04-28_ACTIVE_CODEBASE_ALIGNMENT_REPAIR_TRANCHE.md",
        "var/audit/ledgers/active_codebase_alignment_repair_tranche_ledger.json"
      ],
      "evidence": [
        {
          "path": "var/audit/briefs/2026-04-28_ACTIVE_CODEBASE_ALIGNMENT_REPAIR_TRANCHE.md",
          "claim": "brief status is closed and carry-forward blockers are explicit"
        },
        {
          "path": "var/audit/ledgers/active_codebase_alignment_repair_tranche_ledger.json",
          "claim": "ledger status is closed and no new Atlas tranche is opened"
        }
      ]
    }
  ],
  "verification": {
    "yaml_registry_parsed": true,
    "presence_inventory_json_parsed": true,
    "ledger_json_parsed": true,
    "ledger_schema_json_parsed": true,
    "git_diff_check": "pass",
    "src_files_changed": [],
    "test_files_changed": [],
    "full_pytest": "not_run_in_this_tranche"
  },
  "carry_forward_blockers": [
    "Full repo pytest health not rerun in this repair tranche.",
    "Presence-only and zero-assert Tier A tests remain inventoried, not repaired.",
    "8 Tier A files require later retained-test admission, demotion, or retirement.",
    "5 Tier A files require later registry placement reconciliation.",
    "Capital deployment broader sizing semantics remain outside this tranche."
  ]
}
